{
  "$schema": "https://json-schema.org/draft/2020-12/schema",
  "$id": "https://qspecbench.org/schema/openqasm_profile.schema.json",
  "title": "QSpecBench OpenQASM language profile",
  "type": "object",
  "required": [
    "id",
    "upstream_standard",
    "upstream_version",
    "parser_implementation",
    "parser_version",
    "include_policy",
    "accepted_headers",
    "accepted_declarations",
    "gate_set",
    "angle_grammar",
    "control_flow_support",
    "measurement_support",
    "reset_support",
    "wire_order_convention",
    "global_phase_policy",
    "unsupported_syntax_behavior"
  ],
  "properties": {
    "id": {
      "type": "string",
      "pattern": "^qspecbench\\.openqasm3\\.[a-z0-9_.]+$",
      "description": "Profile identifier referenced by benchmarks as openqasm_profile"
    },
    "upstream_standard": {
      "type": "string",
      "const": "OpenQASM",
      "description": "Upstream language whose syntax this profile subsets"
    },
    "upstream_version": {
      "type": "string",
      "pattern": "^3\\.[0-9]+$",
      "description": "Exact upstream OpenQASM specification version targeted by the profile"
    },
    "parser_implementation": {
      "type": "string",
      "minLength": 1,
      "description": "Concrete parser/AST implementation used by the profile"
    },
    "parser_version": {
      "type": "string",
      "minLength": 1,
      "description": "Version of the parser/profile implementation, not the upstream standard"
    },
    "include_policy": {
      "type": "string",
      "enum": ["skipped_not_interpreted", "rejected", "declared_allowlist"],
      "description": "How include statements are treated; skipped_not_interpreted is not library semantic validation"
    },
    "accepted_headers": {
      "type": "array",
      "items": { "type": "string" },
      "minItems": 1
    },
    "accepted_declarations": {
      "type": "array",
      "items": { "type": "string" },
      "minItems": 1
    },
    "gate_set": {
      "type": "array",
      "items": { "type": "string", "minLength": 1 },
      "minItems": 1
    },
    "angle_grammar": {
      "type": "string",
      "enum": ["none", "pi_rational", "float_literal", "symbolic_restricted"]
    },
    "control_flow_support": {
      "type": "string",
      "enum": ["none", "if_else_classical", "full"]
    },
    "measurement_support": {
      "type": "string",
      "enum": ["none", "projective_record", "full"]
    },
    "reset_support": {
      "type": "string",
      "enum": ["none", "allowed", "full"]
    },
    "wire_order_convention": {
      "type": "string",
      "enum": ["legacy_kron_order", "openqasm_little_endian_wire_order"]
    },
    "global_phase_policy": {
      "type": "string",
      "enum": ["exact", "ignore_global_phase", "declared_phase_policy"]
    },
    "numeric_semantics": {
      "type": ["string", "null"],
      "description": "Arithmetic/approximation model used by the executable denotation"
    },
    "unsupported_syntax_behavior": {
      "type": "string",
      "enum": ["fail_closed", "skip_documented", "reject_executable"]
    },
    "notes": { "type": ["string", "null"] }
  },
  "additionalProperties": false
}
